,tweets_en,sentistrength
10581,"Since my iPhone 6s does not bring the latest version iOS 14, the one that I no longer update since last year is the iPhone 6","{'neg': 0.087, 'neu': 0.913, 'pos': 0.0, 'compound': -0.296}"
10585,"aga, consiglio: IOS 14 su iPhone 7? Sì o no?","{'neg': 0.242, 'neu': 0.758, 'pos': 0.0, 'compound': -0.3736}"
10586,"""in France, a group of advertisers and publishers whined 😪😩 to French authorities about Apple's plan to introduce n…","{'neg': 0.101, 'neu': 0.899, 'pos': 0.0, 'compound': -0.2263}"
10594,ios 14 gua updated 😎 1000000/10 slap no cap fosho,"{'neg': 0.204, 'neu': 0.648, 'pos': 0.148, 'compound': -0.1531}"
10595,Any danger of you fixing the IOS 14 beta update notification bug this any time soon?,"{'neg': 0.185, 'neu': 0.815, 'pos': 0.0, 'compound': -0.5267}"
10602,Hi there. FaceTime is failing to connect between iOS 14.x and iOS 9.x devices. I see more peop…,"{'neg': 0.171, 'neu': 0.829, 'pos': 0.0, 'compound': -0.5106}"
10611,IOS 14.X Bootr0m A8-A14 exploit released 😈. Actually i don’t even know🤣,"{'neg': 0.123, 'neu': 0.877, 'pos': 0.0, 'compound': -0.1027}"
10612,Same here. And is no help at all. I have no mic on my phone since July. Th…,"{'neg': 0.209, 'neu': 0.664, 'pos': 0.128, 'compound': -0.1779}"
10616,Update dude iOS 14 is wicked,"{'neg': 0.405, 'neu': 0.595, 'pos': 0.0, 'compound': -0.5267}"
10620,Check this out: 📲🤯 Should we ‘upgrade’ to iOS 14? + Trap Kit 2 Intro Sale Ends Nov 1st!,"{'neg': 0.139, 'neu': 0.861, 'pos': 0.0, 'compound': -0.3802}"
10622,Got to say (as Apple's No. 2.0 fan) I've been using IOS 14 since the early beta…,"{'neg': 0.121, 'neu': 0.879, 'pos': 0.0, 'compound': -0.296}"
10642,Same here. iPhone 11 with iOS 14.1 no issues.,"{'neg': 0.216, 'neu': 0.784, 'pos': 0.0, 'compound': -0.296}"
10645,The real problem verge had the same point to make a day before.,"{'neg': 0.197, 'neu': 0.803, 'pos': 0.0, 'compound': -0.4019}"
10650,"Even worse once you mess with iOS 14, safemode doesn’t seem to work I just kee…","{'neg': 0.301, 'neu': 0.699, 'pos': 0.0, 'compound': -0.6808}"
10653,I finally fixed my Twitter photo problem. After iOS 14 was installed I couldn’t see photos. Apparently “select phot…,"{'neg': 0.144, 'neu': 0.856, 'pos': 0.0, 'compound': -0.4019}"
10664,niggas be on twitter like “y’all like my iOS 14 layout” no nigga how bout you go layout some bitches,"{'neg': 0.298, 'neu': 0.526, 'pos': 0.175, 'compound': -0.5423}"
10669,"Hi Dave, I am using iPhone 11 with iOS 14.1 and no issues with twitter app. All…","{'neg': 0.128, 'neu': 0.872, 'pos': 0.0, 'compound': -0.296}"
10680,i just updated my phone to IOS 14 and it’s so weird looking holyshit,"{'neg': 0.157, 'neu': 0.843, 'pos': 0.0, 'compound': -0.3052}"
10685,My phone updated to the iOS 14. NO,"{'neg': 0.295, 'neu': 0.705, 'pos': 0.0, 'compound': -0.4466}"
10688,This is driving me crazy there’s no update I can jump to. I’m already on #iOS 14.2,"{'neg': 0.247, 'neu': 0.753, 'pos': 0.0, 'compound': -0.5574}"
10692,the whole season the fantasy app hasn’t worked. Can’t log in. “There was a problem connecting.” Tri…,"{'neg': 0.153, 'neu': 0.847, 'pos': 0.0, 'compound': -0.4019}"
10693,wait if i change my phone i’m gonna loose the ios 14 layout that i spent hours on arent i,"{'neg': 0.126, 'neu': 0.874, 'pos': 0.0, 'compound': -0.3182}"
10701,Is anyone else’s iPhone absolute shit on wifi since the iOS 14 update?? I am CONSTANTLY having to turn wifi on and…,"{'neg': 0.165, 'neu': 0.835, 'pos': 0.0, 'compound': -0.6072}"
10710,Updating IOS 14.1 bantay bitaw ma disappoint ko apple ha!,"{'neg': 0.223, 'neu': 0.597, 'pos': 0.179, 'compound': -0.1511}"
10714,I just noticed you can block callers in iOS 14 and told my wife I'll be busy all afternoon 😂 #nomorespamcalls #ihatespam,"{'neg': 0.132, 'neu': 0.868, 'pos': 0.0, 'compound': -0.4404}"
10715,bat ba ako nag ios 14😀,"{'neg': 0.333, 'neu': 0.667, 'pos': 0.0, 'compound': -0.3612}"
10727,I try iphone x ios 14.2 but failed,"{'neg': 0.471, 'neu': 0.529, 'pos': 0.0, 'compound': -0.6652}"
10731,Ios 14.2 anyone try to jailbreak Iphone x i try but failed,"{'neg': 0.331, 'neu': 0.669, 'pos': 0.0, 'compound': -0.6652}"
10735,my fucking phone updated to ios 14 out of nowhere and now i can't play genshin on my phone omg,"{'neg': 0.102, 'neu': 0.898, 'pos': 0.0, 'compound': -0.2584}"
10736,Also it's crazy to see how well ios 14 holds up on 6S model.,"{'neg': 0.145, 'neu': 0.727, 'pos': 0.127, 'compound': -0.0772}"
10747,There is no update available. I have already updated to iOS 14.2. I have tried a hard reset and the…,"{'neg': 0.194, 'neu': 0.806, 'pos': 0.0, 'compound': -0.3818}"
10753,Upgraded to iOS 14.2 on iPad last night after completing weekend event and game won’t open. Stuck at Lo…,"{'neg': 0.1, 'neu': 0.9, 'pos': 0.0, 'compound': -0.25}"
10755,i tried iphone se 1st gen ios 14.2 error stuck in booting,"{'neg': 0.343, 'neu': 0.657, 'pos': 0.0, 'compound': -0.5719}"
10758,"I had not wanted to download ios 14 and today that I finally did, the only thing I appreciate is being able to hide applications from my home","{'neg': 0.062, 'neu': 0.839, 'pos': 0.099, 'compound': 0.25}"
10762,"It's marketing, almost everyone around me who has an iPhone tells me ...","{'neg': 0.0, 'neu': 1.0, 'pos': 0.0, 'compound': 0.0}"
10765,"I still haven't done that iOS 14 update, but I know one day iPhone is going to force me to do that 😕","{'neg': 0.0, 'neu': 1.0, 'pos': 0.0, 'compound': 0.0}"
10787,That really captured the nerd rage I feel when I contemplate things like Apple’s neglect of desktop comput…,"{'neg': 0.385, 'neu': 0.509, 'pos': 0.106, 'compound': -0.7624}"
10791,"Genius and sneaky ... 🤥Apple added a secret button to your iPhone, and you may not have even noticed #SmartNews","{'neg': 0.095, 'neu': 0.905, 'pos': 0.0, 'compound': -0.2263}"
10794,ok i watched ep16 of death note time to F F make my ios 14 layout,"{'neg': 0.228, 'neu': 0.643, 'pos': 0.129, 'compound': -0.4019}"
10804,Finally Apple fixed the X battery on iOS 14.2,"{'neg': 0.0, 'neu': 1.0, 'pos': 0.0, 'compound': 0.0}"
10806,"iOS 14.1 Follow Up | Battery Problems, Over Heating and Solutions #apple #iOS14 #iphonese…","{'neg': 0.175, 'neu': 0.714, 'pos': 0.11, 'compound': -0.25}"
10812,im changing my ios 14 to a sad ist one later lmaokk,"{'neg': 0.237, 'neu': 0.763, 'pos': 0.0, 'compound': -0.4767}"
10819,Same. iOS 14 said BOO BITCH,"{'neg': 0.476, 'neu': 0.524, 'pos': 0.0, 'compound': -0.6739}"
10820,wait since ios 14.2 is officially out everyone else finally has the trans flag emoji :o 🏳️‍⚧️🏳️‍⚧️🏳️‍⚧️,"{'neg': 0.08, 'neu': 0.92, 'pos': 0.0, 'compound': -0.1027}"
10828,Ok but what about my battery life tho? iOS 14 is killing my iPhone 11 that I’ve only had for a year.,"{'neg': 0.228, 'neu': 0.712, 'pos': 0.06, 'compound': -0.7579}"
10829,phone just updated to IOS 14 without my consent ...?,"{'neg': 0.156, 'neu': 0.844, 'pos': 0.0, 'compound': -0.1695}"
10832,"My phone automatically upgraded to iOS 14 overnight... I forget, what’s the major differences again?","{'neg': 0.128, 'neu': 0.872, 'pos': 0.0, 'compound': -0.2263}"
10840,I point out again that both on ipad and iphone with ios 14.1 the app crashes on opening and not even ...,"{'neg': 0.0, 'neu': 1.0, 'pos': 0.0, 'compound': 0.0}"
10843,Y’all iOS 14 is mirroring the front camera now. Snapchat is really bout to be obsolete now.,"{'neg': 0.121, 'neu': 0.879, 'pos': 0.0, 'compound': -0.296}"
10850,Having a hard time downloading the purchased shows into the podcast app in ios 14. Am i missing something?,"{'neg': 0.194, 'neu': 0.806, 'pos': 0.0, 'compound': -0.3818}"
10854,How do you see images beyond the first two in a tweet? I tried different ways and sadly failed on iPad…,"{'neg': 0.264, 'neu': 0.736, 'pos': 0.0, 'compound': -0.7269}"
10855,#kpop nsfw porn boobs kpop manga korean pop loona blackpink edit rt if you stan gc gdm hot dick cock rate giveaway…,"{'neg': 0.197, 'neu': 0.803, 'pos': 0.0, 'compound': -0.5994}"
10856,ios 14 is so fucking ugly,"{'neg': 0.436, 'neu': 0.564, 'pos': 0.0, 'compound': -0.5956}"
10862,Am I the only one not fully enjoying iOS 14.1? The new placement of all my apps and widgets is annoying and simply…,"{'neg': 0.222, 'neu': 0.778, 'pos': 0.0, 'compound': -0.6901}"
10867,euphoria ariana grande lockdown halloween animal crossing nudes 18+ leak leaked thread bts harry styles charli dame…,"{'neg': 0.204, 'neu': 0.609, 'pos': 0.187, 'compound': 0.1531}"
10872,I been avoiding this iOS 14 update and my phone wanna update when I’m sleep 🙄,"{'neg': 0.156, 'neu': 0.844, 'pos': 0.0, 'compound': -0.34}"
10873,There’s been two iOS patches since 14 came out and they’ve still not fixed the opening an app in a folder lag! Open…,"{'neg': 0.114, 'neu': 0.886, 'pos': 0.0, 'compound': -0.4003}"
10874,"J’ai essayé de personnaliser mon écran d’accueil iOS 14 et tout, j’ai tout enlevé en exactement 13 minutes","{'neg': 0.158, 'neu': 0.842, 'pos': 0.0, 'compound': -0.25}"
10885,"Yo @apple, been almost 2 months now. Fix the lag on the keyboard for iOS 14.","{'neg': 0.146, 'neu': 0.854, 'pos': 0.0, 'compound': -0.34}"
10890,French advertisers file complaint over Apple’s iOS 14 privacy plan | AppleInsider EAD MOE:…,"{'neg': 0.155, 'neu': 0.845, 'pos': 0.0, 'compound': -0.296}"
10893,ios 14.1: does not look good to me,"{'neg': 0.256, 'neu': 0.744, 'pos': 0.0, 'compound': -0.3412}"
10916,Meu irmão mexeu no meu cll e coloco pra atualizar pro iOS 14 aff man,"{'neg': 0.145, 'neu': 0.855, 'pos': 0.0, 'compound': -0.296}"
10923,Yea. iOS 14 shit. No option to rearrange the app in the app library. Why would anyone need…,"{'neg': 0.266, 'neu': 0.734, 'pos': 0.0, 'compound': -0.7003}"
10935,my phone automatically updated to iOS 14.1 in the middle of the night. i’m not prepared for this.,"{'neg': 0.089, 'neu': 0.911, 'pos': 0.0, 'compound': -0.1695}"
10942,anybody else's iphone is asking them to update to the latest ios 14 eventhough you swear you've updated to the late…,"{'neg': 0.057, 'neu': 0.943, 'pos': 0.0, 'compound': -0.0516}"
10947,Yellow Facebook doesn’t work on iOS 14.2. Normally I’d be mad but getting far less side tracked at the gym today.,"{'neg': 0.095, 'neu': 0.905, 'pos': 0.0, 'compound': -0.2732}"
10961,why the fuck did my phone update to the new iOS 14 overnight- i hate it so much,"{'neg': 0.324, 'neu': 0.676, 'pos': 0.0, 'compound': -0.802}"
10967,ios 14 po yann??? ano pong iphone mo,"{'neg': 0.372, 'neu': 0.628, 'pos': 0.0, 'compound': -0.6298}"
10969,Die gute Nachricht: iOS 14.2 kennt jetzt auch den Ninja 🥷,"{'neg': 0.302, 'neu': 0.698, 'pos': 0.0, 'compound': -0.5994}"
10973,Danke! Wie gesagt - es wär schön wenn Microsoft ein Update bringen würde für die App. iOS 14 gibt e…,"{'neg': 0.189, 'neu': 0.811, 'pos': 0.0, 'compound': -0.636}"
10978,❌ Thameslink update: 15:28 Welwyn Garden City to London Kings Cross due 16:14 will be cancelled. Download the Train Beacon…,"{'neg': 0.1, 'neu': 0.9, 'pos': 0.0, 'compound': -0.25}"
10988,iphone 12 ios 14 home screen 👇 %30 off for limited time Use code iphone12 #iOS14…,"{'neg': 0.119, 'neu': 0.881, 'pos': 0.0, 'compound': -0.2263}"
10990,"rather than sleep, i spent an obnoxious amount of time last night updating my phone to ios 14 and arranging my apps/widgets.","{'neg': 0.13, 'neu': 0.87, 'pos': 0.0, 'compound': -0.4588}"
10996,Spotify Individu Plan #byzeetesti t. who sells cheap spotify premium can extend Netflix anti on hold apple ...,"{'neg': 0.115, 'neu': 0.8, 'pos': 0.085, 'compound': -0.1531}"
10998,Spotify Family Plan #byzeetesti t. who sells cheap Spotify premium can extend your Netflix anti on hold apple ...,"{'neg': 0.11, 'neu': 0.81, 'pos': 0.081, 'compound': -0.1531}"
10999,"Since ios 14 I change my home screen all the time, so I almost feel like I change my home screen every time","{'neg': 0.0, 'neu': 0.884, 'pos': 0.116, 'compound': 0.3581}"
11000,❌ Thameslink update: 15:28 Welwyn Garden City to London Kings Cross due 16:14 will be cancelled. Download the Train Beacon iOS app today ❌,"{'neg': 0.087, 'neu': 0.913, 'pos': 0.0, 'compound': -0.25}"
11004,Casi dos meses que salió iOS 14 y todavía no tiene widget,"{'neg': 0.18, 'neu': 0.82, 'pos': 0.0, 'compound': -0.296}"
11011,"hello sirs, it is with maximum croco we would shake to the modifications of switchboards and a…","{'neg': 0.096, 'neu': 0.904, 'pos': 0.0, 'compound': -0.1779}"
11016,NEW Install Pokemon Go Spoofer iOS 14 - 13 NO Jailbreak/Computer! (iPoGo... via @YouTube,"{'neg': 0.212, 'neu': 0.788, 'pos': 0.0, 'compound': -0.4981}"
11018,❌ Northern update: 14:45 Manchester Piccadilly to Sheffield due 16:04 has been cancelled. Download the Train Beacon…,"{'neg': 0.118, 'neu': 0.882, 'pos': 0.0, 'compound': -0.25}"
11038,Just downloaded IOS 14.1 a few days ago. That’s when the problems started.,"{'neg': 0.197, 'neu': 0.803, 'pos': 0.0, 'compound': -0.4019}"
11049,what are you doing rn — making ios 14 thingy zzz,"{'neg': 0.196, 'neu': 0.804, 'pos': 0.0, 'compound': -0.296}"
11052,New IOS 14 issue. Touchscreen delays of several secs. Audio cuts out intermittently on all audio and vi…,"{'neg': 0.115, 'neu': 0.885, 'pos': 0.0, 'compound': -0.296}"
11056,Sorry for the inconvenience. Want to update ios 14.2 to update 14.1 first?,"{'neg': 0.252, 'neu': 0.662, 'pos': 0.086, 'compound': -0.3612}"
11059,"iOS 14.1 broke so much stuff on my phone. And of course didn't keep any preference settings from 13, so every godda…","{'neg': 0.118, 'neu': 0.882, 'pos': 0.0, 'compound': -0.4215}"
11069,how do I get rid of the stupid message telling me there is a a New iOS Update is Now Available. Somet…,"{'neg': 0.159, 'neu': 0.841, 'pos': 0.0, 'compound': -0.5267}"
11073,❌ Transport for Wales update: 02/11/20 14:57 Blaenau Ffestiniog to Llandudno due 16:15 will be cancelled. Download…,"{'neg': 0.118, 'neu': 0.882, 'pos': 0.0, 'compound': -0.25}"
11077,❌ Transport for Wales update: 02/11/20 13:14 Llandudno to Blaenau Ffestiniog due 14:35 will be cancelled. Download…,"{'neg': 0.118, 'neu': 0.882, 'pos': 0.0, 'compound': -0.25}"
11083,I updated my iPhone 11 Pro to iOS 14.1 and now have serious battery issues. My Battery has onl…,"{'neg': 0.071, 'neu': 0.929, 'pos': 0.0, 'compound': -0.0772}"
11087,Am I the only getting this annoying message on ios - A new iOS update is now available. Please update from the iOS…,"{'neg': 0.133, 'neu': 0.768, 'pos': 0.098, 'compound': -0.2083}"
11094,"I started making ios 14 widgets, it's 3:30 pm and my phone is awful","{'neg': 0.2, 'neu': 0.8, 'pos': 0.0, 'compound': -0.4588}"
11096,I can’t believe there’s an iOS 14.1 already. I haven’t downloaded 14 yet because I’m nervous it could screw up my phone,"{'neg': 0.163, 'neu': 0.837, 'pos': 0.0, 'compound': -0.3612}"
11098,Why does IOS 14.1 have to act like Harvey Weinstein? No means No!,"{'neg': 0.273, 'neu': 0.582, 'pos': 0.145, 'compound': -0.2942}"
11101,"One thing I noticed in iOS 14.1 is that when the battery reaches 15% it drops 1% every second, now I have little…","{'neg': 0.0, 'neu': 0.943, 'pos': 0.057, 'compound': 0.0516}"
11115,i need sort my camera roll out its a mess and i need to do my ios 14 thing but idk what to do might do a dream smp…,"{'neg': 0.12, 'neu': 0.79, 'pos': 0.09, 'compound': 0.0387}"
11119,IOS 14.1 sucks!,"{'neg': 0.583, 'neu': 0.417, 'pos': 0.0, 'compound': -0.4199}"
11120,❌ Northern update: 13:56 Crewe to Manchester Piccadilly due 14:44 has been cancelled. Download the Train Beacon iOS…,"{'neg': 0.111, 'neu': 0.889, 'pos': 0.0, 'compound': -0.25}"
11126,❌ Transport for Wales update: 02/11/20 14:41 Llandudno to Chester due 15:47 will be cancelled. Download the Train B…,"{'neg': 0.105, 'neu': 0.895, 'pos': 0.0, 'compound': -0.25}"
11128,❌ Transport for Wales update: 02/11/20 12:58 Chester to Llandudno due 14:03 will be cancelled. Download the Train B…,"{'neg': 0.105, 'neu': 0.895, 'pos': 0.0, 'compound': -0.25}"
11139,I don’t mine 14.1 it fixed a lot of problems with iOS 14.0.3,"{'neg': 0.213, 'neu': 0.787, 'pos': 0.0, 'compound': -0.4019}"
11146,question: how with iOS 14 can I watch my YT video while doing something else please,"{'neg': 0.0, 'neu': 0.859, 'pos': 0.141, 'compound': 0.3182}"
11152,❌ Transport for Wales update: 02/11/20 13:16 Maesteg to Cardiff Central due 14:10 will be cancelled. Download the T…,"{'neg': 0.105, 'neu': 0.895, 'pos': 0.0, 'compound': -0.25}"
11154,"Hey, it's a shame that the iOS 14 PIP works with all apps, except Facebook, YouTube and Twitter, so I can't see the Colo game 🤡","{'neg': 0.124, 'neu': 0.876, 'pos': 0.0, 'compound': -0.4767}"
11158,Having problems with iOS 14.1 1. No sign for received or missed calls 2.Glitches in the screen (need restart) 3.Whe…,"{'neg': 0.295, 'neu': 0.705, 'pos': 0.0, 'compound': -0.7269}"
11190,I’m very upset that iOS 14.1 forces you to turn on two-factor authentication. This causes no end of problems when traveling.,"{'neg': 0.302, 'neu': 0.698, 'pos': 0.0, 'compound': -0.7778}"
11191,So ios 14 finally attacked my phone and IHIH,"{'neg': 0.273, 'neu': 0.727, 'pos': 0.0, 'compound': -0.4588}"
11193,And ios 12 not supported yet so my my suggesting is to update it to iOS 14.1 and try FMI OFF,"{'neg': 0.089, 'neu': 0.911, 'pos': 0.0, 'compound': -0.2411}"
11218,euphoria ariana grande animal crossing cardi b nudes 18+ leak leaked nsfw thread bts harry styles charli damelio no…,"{'neg': 0.196, 'neu': 0.625, 'pos': 0.179, 'compound': 0.1531}"
11220,❌ Northern update: 14:46 Windermere to Oxenholme Lake District due 15:05 will be cancelled. Download the Train Beac…,"{'neg': 0.111, 'neu': 0.889, 'pos': 0.0, 'compound': -0.25}"
11222,❌ Northern update: 14:22 Oxenholme Lake District to Windermere due 14:41 will be cancelled. Download the Train Beac…,"{'neg': 0.111, 'neu': 0.889, 'pos': 0.0, 'compound': -0.25}"
11227,It was an example. There’s no ipwndfu/checkm8/eclipsa or whatever for S…,"{'neg': 0.18, 'neu': 0.82, 'pos': 0.0, 'compound': -0.296}"
11231,❌ Northern update: 13:59 Windermere to Oxenholme Lake District due 14:18 will be cancelled. Download the Train Beac…,"{'neg': 0.111, 'neu': 0.889, 'pos': 0.0, 'compound': -0.25}"
11238,AirPlay on iOS 14.2 was 🥰,"{'neg': 0.0, 'neu': 1.0, 'pos': 0.0, 'compound': 0.0}"
11240,⏭️ Transport for Wales update: 14:34 Crewe to Holyhead due 16:53 will no longer call at Conwy. Download the Train B…,"{'neg': 0.099, 'neu': 0.901, 'pos': 0.0, 'compound': -0.296}"
11243,ios 14 a full downgrade wtf is this,"{'neg': 0.388, 'neu': 0.612, 'pos': 0.0, 'compound': -0.5859}"
11244,⏭️ Transport for Wales update: 12:27 Crewe to Holyhead due 14:58 will no longer call at Conwy. Download the Train B…,"{'neg': 0.099, 'neu': 0.901, 'pos': 0.0, 'compound': -0.296}"
11260,AirPlay on iOS 14.2 was 🥰,"{'neg': 0.0, 'neu': 1.0, 'pos': 0.0, 'compound': 0.0}"
11261,Their cell phones also updated themselves to IOS 14.1 or it was only mine that didn't even have 14,"{'neg': 0.0, 'neu': 1.0, 'pos': 0.0, 'compound': 0.0}"
11262,iPhone Home screens gone wild! [Cult of Mac Magazine 368] Customizing iPhone Home screens is all the rage right no…,"{'neg': 0.17, 'neu': 0.83, 'pos': 0.0, 'compound': -0.5983}"
11267,IOS 14.1 keeps getting stuck on preparing update. Don’t tell this means I may need a new phone soon.,"{'neg': 0.111, 'neu': 0.889, 'pos': 0.0, 'compound': -0.25}"
11270,I keep getting IOS 14 update available from Beta and it’s persistently irritating,"{'neg': 0.214, 'neu': 0.786, 'pos': 0.0, 'compound': -0.4588}"
11276,"Using back Gboard on iOS, keyboard lag on default keyboard on iOS 14.","{'neg': 0.167, 'neu': 0.833, 'pos': 0.0, 'compound': -0.34}"
11279,"I thought this was a weirdly timed April Fool when I read the headline, but there is (kind of) a secret button on y…","{'neg': 0.165, 'neu': 0.835, 'pos': 0.0, 'compound': -0.3716}"
11285,iOS 14.1’s battery life seems to be even worse. 21% after just a few hours of regular use.,"{'neg': 0.162, 'neu': 0.838, 'pos': 0.0, 'compound': -0.4767}"
11289,But iOS 14.2 signal is not good,"{'neg': 0.286, 'neu': 0.714, 'pos': 0.0, 'compound': -0.3412}"
11297,❌ Northern update: 14:54 Buxton to Manchester Piccadilly due 15:54 will be cancelled. Download the Train Beacon iOS…,"{'neg': 0.111, 'neu': 0.889, 'pos': 0.0, 'compound': -0.25}"
11300,I seem like to have the same problem with my iPhone 11. iOS 14.1 is drainining my battery double as fast.,"{'neg': 0.116, 'neu': 0.776, 'pos': 0.108, 'compound': -0.0516}"
11301,💣 iemove bypass The First Instant iOS 14-14.1 iCloud/SIM Lock Bypass In Market 6s to X ⭐ No Need Terminal to ja…,"{'neg': 0.109, 'neu': 0.891, 'pos': 0.0, 'compound': -0.296}"
11302,I want to customize iOS 14 and not at the same time 🥺,"{'neg': 0.0, 'neu': 0.885, 'pos': 0.115, 'compound': 0.0772}"
11306,Ok re: iOS 14— 1) Why can’t I turn off this stupid App Library? (insulting everyone’s organizational…,"{'neg': 0.198, 'neu': 0.693, 'pos': 0.109, 'compound': -0.4215}"
11309,atualizei pro iOS 14 e agora entrou nome de espinossauro no meu game center não entendi,"{'neg': 0.136, 'neu': 0.864, 'pos': 0.0, 'compound': -0.296}"
11328,❌ Northern update: 16:14 Sheffield to Manchester Piccadilly due 17:34 will be cancelled. Download the Train Beacon…,"{'neg': 0.118, 'neu': 0.882, 'pos': 0.0, 'compound': -0.25}"
11330,❌ Northern update: 14:45 Manchester Piccadilly to Sheffield due 16:04 will be cancelled. Download the Train Beacon…,"{'neg': 0.118, 'neu': 0.882, 'pos': 0.0, 'compound': -0.25}"
11343,"EU QUEO O diálogo está para que não fiz NADA NADA NADA NADA NADA mais inconveniente do iOS 14 and shit, when you butchered","{'neg': 0.141, 'neu': 0.859, 'pos': 0.0, 'compound': -0.5574}"
11352,iOs 14 il s’est installé tout seul hier soir ptn bye bye ma batterie,"{'neg': 0.103, 'neu': 0.897, 'pos': 0.0, 'compound': -0.128}"
11362,- « tu vas voir IOS 14 c’est trop bien »mon téléphone mtn qui fait des captures d’écrans tout seul :,"{'neg': 0.081, 'neu': 0.919, 'pos': 0.0, 'compound': -0.128}"
11364,- « tu vas voir IOS 14 c’est trop bien »mon téléphone mtn qui fait des captures d’écrans tout seul :,"{'neg': 0.081, 'neu': 0.919, 'pos': 0.0, 'compound': -0.128}"
11366,"And dito for Xcode 12.1.1 and iOS 14.2 GM that Apple released yesterday. A macOS GM SDK is still MIA, so the latest .fx f…","{'neg': 0.113, 'neu': 0.887, 'pos': 0.0, 'compound': -0.4466}"
11372,I'm not going to update you iOS 14❤️,"{'neg': 0.0, 'neu': 1.0, 'pos': 0.0, 'compound': 0.0}"
11376,iOS 14 has fucked my autocorrect 😠,"{'neg': 0.468, 'neu': 0.532, 'pos': 0.0, 'compound': -0.6597}"
11380,Apple downloaded last update 14.uin my FB App. I tried everything! It freezes! Next tablet will not be IOS!,"{'neg': 0.104, 'neu': 0.896, 'pos': 0.0, 'compound': -0.2444}"
11384,they removed it on ios 14 :(,"{'neg': 0.326, 'neu': 0.674, 'pos': 0.0, 'compound': -0.4404}"
11392,"Como indica Lourdes, la aplicación #YoLeoGas no funciona, da error en la conexión. Lo he prob…","{'neg': 0.259, 'neu': 0.741, 'pos': 0.0, 'compound': -0.5994}"
11398,I hate iOS 14 - it removed all my passwords and face settings - and now it doesn’t recognize my passcode to…,"{'neg': 0.171, 'neu': 0.829, 'pos': 0.0, 'compound': -0.5719}"
11399,COMO COLOCA A SUA FOTO FAVOITA NO WIDGET FOTOS | iOS 14 🚀 #ios14 #Apple #iPhone 🚀,"{'neg': 0.196, 'neu': 0.804, 'pos': 0.0, 'compound': -0.4466}"
11400,COMO COLOCA A SUA FOTO FAVOITA NO WIDGET FOTOS | iOS 14 🚀 #ios14 #Apple #iPhone 🚀,"{'neg': 0.196, 'neu': 0.804, 'pos': 0.0, 'compound': -0.4466}"
11404,I feel trapped by iOS 14. Don’t swipe too many times in either side or you enter some sort of hell dimension of Apple’s design.,"{'neg': 0.274, 'neu': 0.726, 'pos': 0.0, 'compound': -0.8516}"
11410,trying to customise my phone according to the ios 14 homescreen update and failing horribly atm &lt;3,"{'neg': 0.309, 'neu': 0.691, 'pos': 0.0, 'compound': -0.7717}"
11429,"Acordei com meu celular no iOS 14.1 uai, q doideira","{'neg': 0.216, 'neu': 0.784, 'pos': 0.0, 'compound': -0.296}"
11430,I woke up with my phone on iOS 14.1,"{'neg': 0.0, 'neu': 1.0, 'pos': 0.0, 'compound': 0.0}"
11435,ealizing now that keeping me phone on the beta version of iOS is going to be a royal pain when my new phone comes…,"{'neg': 0.13, 'neu': 0.87, 'pos': 0.0, 'compound': -0.5106}"
11442,oboy try update that woman ios.....she no wan update to 14,"{'neg': 0.18, 'neu': 0.82, 'pos': 0.0, 'compound': -0.296}"
11446,"My Twitter on iPad Pro 12,9 2020 withe iOS 14.1 ( No Beta ) is crashing when ietweet a tweet Whit…","{'neg': 0.115, 'neu': 0.885, 'pos': 0.0, 'compound': -0.296}"
11453,"Oho, day 4 and #VoiceOver hung on # iPhone12Pro running iOS 14.1 - looped sound. Only a hard reset helped. # a11y @AppleSupport","{'neg': 0.076, 'neu': 0.924, 'pos': 0.0, 'compound': -0.1027}"
11480,This new way to set an alarm on iOS 14 was a pain in the ass,"{'neg': 0.434, 'neu': 0.566, 'pos': 0.0, 'compound': -0.8481}"
11485,iOS 14.1 is fast and furious. OMG,"{'neg': 0.381, 'neu': 0.619, 'pos': 0.0, 'compound': -0.5719}"
11489,"My iPhone refuses to leave the beta program. Presumably Apple's way of making me upgrade to an iPhone 12. Also, do…","{'neg': 0.057, 'neu': 0.943, 'pos': 0.0, 'compound': -0.0516}"
11497,"Sneaky. Apple added a secret button to your iPhone, and you may not have even noticed via @Verge","{'neg': 0.106, 'neu': 0.894, 'pos': 0.0, 'compound': -0.2263}"
11514,Is it just me or my iPhone went to shit with those iOS 14 updates ?,"{'neg': 0.205, 'neu': 0.795, 'pos': 0.0, 'compound': -0.5574}"
11515,I have the same error. Ios 14.1,"{'neg': 0.351, 'neu': 0.649, 'pos': 0.0, 'compound': -0.4019}"
11525,😂😂😂 no go install iOS 14 o,"{'neg': 0.306, 'neu': 0.694, 'pos': 0.0, 'compound': -0.296}"
