,tweets_en,sentistrength
7740,I heard i if you factory reset it. IOS 14 fucked it up but I haven’t tried,"{'neg': 0.172, 'neu': 0.828, 'pos': 0.0, 'compound': -0.4019}"
7763,Also because I am bad at copy editing: The chart should read iOS 13 versus iOS 14 launches. Typos gonna typo!,"{'neg': 0.166, 'neu': 0.834, 'pos': 0.0, 'compound': -0.5848}"
7768,"I swear to god, Apple really fucked everything up with ios 14 and especially 14.1 Idk WHY but everything is shit n…","{'neg': 0.367, 'neu': 0.577, 'pos': 0.056, 'compound': -0.8241}"
7778,"Sento dire che oggi verrà rilasciato iOS 14.2, sarà vero? Boh, io lo spero ma la vedo particolarmente difficile.","{'neg': 0.143, 'neu': 0.857, 'pos': 0.0, 'compound': -0.4588}"
7781,iOS 14.1 makes 5G only a little less confusing than Android 11,"{'neg': 0.117, 'neu': 0.883, 'pos': 0.0, 'compound': -0.0846}"
7791,my phone updated to ios 14 overnight w out telling me and i'm v angry about it,"{'neg': 0.191, 'neu': 0.809, 'pos': 0.0, 'compound': -0.5106}"
7797,w blm paham ios 14 :(,"{'neg': 0.42, 'neu': 0.58, 'pos': 0.0, 'compound': -0.4404}"
7799,Updating to iOS 14 on an iPhone 8 is beyond ridiculous,"{'neg': 0.217, 'neu': 0.783, 'pos': 0.0, 'compound': -0.3612}"
7800,Why Facebook Is Very Worried About Apple’s iOS 14 by,"{'neg': 0.217, 'neu': 0.783, 'pos': 0.0, 'compound': -0.3597}"
7802,"Downloading #iOS 14.2 GM # iOS14 on # iPhone11, I couldn't wait any longer to retest the #Apple betas 🤪🤗 #Apple h…","{'neg': 0.0, 'neu': 1.0, 'pos': 0.0, 'compound': 0.0}"
7803,"Descargando #iOS 14.2 GM #iOS14 en el #iPhone11 ,no he podido esperar más para volver a probar las betas de #Apple…","{'neg': 0.104, 'neu': 0.896, 'pos': 0.0, 'compound': -0.296}"
7811,"If anybody wants a distraction, I’ve got 600 pages on my website where you can learn all about Siri Shortcuts","{'neg': 0.126, 'neu': 0.874, 'pos': 0.0, 'compound': -0.3818}"
7830,#iPhone12Pro Videos der letzten Woche 👉 1️⃣ Apple iPhone 12 (Pro) Tipps &amp; Tricks - die besten Funktionen in iOS 1…,"{'neg': 0.241, 'neu': 0.759, 'pos': 0.0, 'compound': -0.6597}"
7832,but how long have you had it? because I bought mine this year in February and it is not supposed to be ...,"{'neg': 0.0, 'neu': 1.0, 'pos': 0.0, 'compound': 0.0}"
7837,"I don’t understand my cell phone today, it’s been an hour since it’s 100% off the charger and cmg stirring. IOS 14.1? Who did this miracle?","{'neg': 0.0, 'neu': 0.832, 'pos': 0.168, 'compound': 0.7059}"
7843,ios 14.2GM fucked up everything on my phone there,"{'neg': 0.355, 'neu': 0.645, 'pos': 0.0, 'compound': -0.6597}"
7855,Je trouve la mise à jour IOS 14 quand même BAD.,"{'neg': 0.32, 'neu': 0.68, 'pos': 0.0, 'compound': -0.6408}"
7856,I wasn't going to update my phone to iOS 14 and Apple stopped recognizing my fingerprint and in the end I had to update it 🤡🤡🤡🤡🤡🤡,"{'neg': 0.076, 'neu': 0.924, 'pos': 0.0, 'compound': -0.2263}"
7861,"Hello, the Itaú Key does not work for a while with iOS 14 😔 I need to transfer","{'neg': 0.0, 'neu': 1.0, 'pos': 0.0, 'compound': 0.0}"
7870,Ugh phone updated to iOS 14 by it self ☹️,"{'neg': 0.237, 'neu': 0.763, 'pos': 0.0, 'compound': -0.4215}"
7872,The only thing I expect from iOS 14.2 (which I also expected from iOS 14.1) is that Apple Pay is released for Mexico.,"{'neg': 0.065, 'neu': 0.935, 'pos': 0.0, 'compound': -0.1027}"
7888,euphoria ariana grande animal crossing cardi b nudes leak leaked thread bts harry styles charli damelio noah beck…,"{'neg': 0.204, 'neu': 0.609, 'pos': 0.187, 'compound': 0.1531}"
7896,Anyone with the ios 14 beta on their phone getting this error message as well ?,"{'neg': 0.171, 'neu': 0.713, 'pos': 0.115, 'compound': -0.2558}"
7915,iOS 14: How to manage alarms based on your sleep pattern | Macworld,"{'neg': 0.16, 'neu': 0.84, 'pos': 0.0, 'compound': -0.2732}"
7917,"That's not what we like to hear! To clarify, are you on iOS 14.1? What specific iPhone and version of…","{'neg': 0.112, 'neu': 0.888, 'pos': 0.0, 'compound': -0.3404}"
7921,"Why is your iOS app so terrible? It is almost unusable. iPhone Xs, IOS 14.1. After reading half an articl…","{'neg': 0.174, 'neu': 0.826, 'pos': 0.0, 'compound': -0.6113}"
7933,iOS 14 is the worst iPhone battery performance I have ever experienced in a decade of iPhones,"{'neg': 0.227, 'neu': 0.773, 'pos': 0.0, 'compound': -0.6249}"
7941,In these grim times I am disproportionately impressed by this... via @Verge,"{'neg': 0.234, 'neu': 0.57, 'pos': 0.196, 'compound': -0.1531}"
7945,11. #SwiftUI When to use it? If you're going to build a new app which is #iOS 14+ (not 13 no even collectionView…,"{'neg': 0.095, 'neu': 0.905, 'pos': 0.0, 'compound': -0.296}"
7948,"⏭️ South Westernailway update: 14:44 Southampton Central to Fratton due 15:37 will no longer call at Portchester,…","{'neg': 0.121, 'neu': 0.879, 'pos': 0.0, 'compound': -0.296}"
7989,"sad when I don't see any tweak supporting ios 14, let me ask how to change wifi color","{'neg': 0.148, 'neu': 0.714, 'pos': 0.138, 'compound': -0.0516}"
7990,idk what happened in iOS 14 but you really cannot block a number and stop them from texting you. is this a known issue?,"{'neg': 0.21, 'neu': 0.66, 'pos': 0.129, 'compound': -0.0521}"
7992,Τεχνολογία: How to manage alarms based on your sleep pattern in iOS 14,"{'neg': 0.149, 'neu': 0.851, 'pos': 0.0, 'compound': -0.2732}"
7993,Fuck you weeeee I downloaded the iOS 14 and the fucking bitch battery is not lasting me or cock,"{'neg': 0.38, 'neu': 0.62, 'pos': 0.0, 'compound': -0.8479}"
7999,I am using V2.6version. ios 14.1 not ok,"{'neg': 0.239, 'neu': 0.761, 'pos': 0.0, 'compound': -0.2235}"
8014,why did my phone update to ios 14. this ugly,"{'neg': 0.301, 'neu': 0.699, 'pos': 0.0, 'compound': -0.596}"
8017,I hate ios 14,"{'neg': 0.649, 'neu': 0.351, 'pos': 0.0, 'compound': -0.5719}"
8032,Does anyone know if iOS 14.1 for iPhones has solved the battery usage problem?? @Apple,"{'neg': 0.169, 'neu': 0.716, 'pos': 0.116, 'compound': -0.2406}"
8044,iOS 14.1 u confuse me af,"{'neg': 0.322, 'neu': 0.678, 'pos': 0.0, 'compound': -0.2263}"
8049,iOS 14 gives me anxiety idk how to organize anything??? I like everything where it is?,"{'neg': 0.219, 'neu': 0.647, 'pos': 0.135, 'compound': 0.3313}"
8052,How to manage alarms based on your sleep pattern in iOS 14,"{'neg': 0.16, 'neu': 0.84, 'pos': 0.0, 'compound': -0.2732}"
8054,The symptom of the problem is occurring on iOS 14.1 iPhone 7 Plus.,"{'neg': 0.197, 'neu': 0.803, 'pos': 0.0, 'compound': -0.4019}"
8074,wow my ipad auto updated to ios 14 i fucking hate it here,"{'neg': 0.224, 'neu': 0.562, 'pos': 0.214, 'compound': -0.0498}"
8085,I just did the iOS 14 update and the fact you can watch videos and still do shit is blowing me mind,"{'neg': 0.153, 'neu': 0.847, 'pos': 0.0, 'compound': -0.5574}"
8089,"I'll just back up icloud, why did you auto update on ios 14? 😩","{'neg': 0.0, 'neu': 1.0, 'pos': 0.0, 'compound': 0.0}"
8090,Updated Twitch iOS app on iOS 14.1 and the dark mode setting in profile has no effect - has anyone else had this issue?,"{'neg': 0.091, 'neu': 0.909, 'pos': 0.0, 'compound': -0.296}"
8092,How to manage alarms based on your sleep pattern in iOS 14: You might have noticed in iOS 14 that you can set your…,"{'neg': 0.084, 'neu': 0.916, 'pos': 0.0, 'compound': -0.2732}"
8093,i'm late but how can i rearrange your iphone with ios 14 i'm coming?,"{'neg': 0.0, 'neu': 1.0, 'pos': 0.0, 'compound': 0.0}"
8096,nag update ako ios 14.1 tas nasira :(,"{'neg': 0.474, 'neu': 0.526, 'pos': 0.0, 'compound': -0.6597}"
8098,I updated ios 14.1 ate tas sya sya,"{'neg': 0.0, 'neu': 1.0, 'pos': 0.0, 'compound': 0.0}"
8103,APPLE FIX BUGS AND STABILITY ON IOS 14.2. MY #iPhone8 IS SLUGGISH WITH UNSTABLE UI ANDESPONSE TIME IS AWFUL.,"{'neg': 0.394, 'neu': 0.606, 'pos': 0.0, 'compound': -0.886}"
8105,after iOS 14.1 my iPhone 11 Pro Max is acting strange and making the phone act up,"{'neg': 0.101, 'neu': 0.899, 'pos': 0.0, 'compound': -0.2023}"
8121,❌ Transport for Wales update: 14:32 Bidston to Wrexham General due 15:27 will be cancelled. Download the Train Beac…,"{'neg': 0.105, 'neu': 0.895, 'pos': 0.0, 'compound': -0.25}"
8127,❌ Transport for Wales update: 13:32 Wrexham General to Bidston due 14:28 has been cancelled. Download the Train Bea…,"{'neg': 0.105, 'neu': 0.895, 'pos': 0.0, 'compound': -0.25}"
8144,"The iPhone 6s from 2015 got the update to iOS 14. That was the case, but is no longer up to date.","{'neg': 0.118, 'neu': 0.882, 'pos': 0.0, 'compound': -0.4215}"
8179,"⏭️ South Westernailway update: 13:42 Fratton to Southampton Central due 14:38 will no longer call at Hilsea, Cosh…","{'neg': 0.115, 'neu': 0.885, 'pos': 0.0, 'compound': -0.296}"
8181,"“Veja o que há de novo no iOS 14” : ele acaba com sua bateria em 5 min, é isso","{'neg': 0.128, 'neu': 0.872, 'pos': 0.0, 'compound': -0.296}"
8190,Dapat talaga di ako nag IOs 14 eh HAHAHAAH,"{'neg': 0.238, 'neu': 0.762, 'pos': 0.0, 'compound': -0.3612}"
8218,Serious you're listening to music that suddenly cuts you off and your a fucking ringtone instead ...,"{'neg': 0.2, 'neu': 0.8, 'pos': 0.0, 'compound': -0.3612}"
8231,How to manage alarms based on your sleep pattern in iOS 14,"{'neg': 0.16, 'neu': 0.84, 'pos': 0.0, 'compound': -0.2732}"
8240,iOS 14 Battery Life Bad &amp; Draining Fast? Here’s Why &amp; How to Fix It,"{'neg': 0.2, 'neu': 0.8, 'pos': 0.0, 'compound': -0.5423}"
8241,Esperemos que si Elias. Que ah pasado con SmartPods?😭 solo quisiera usar ese modo espacial sin ten…,"{'neg': 0.184, 'neu': 0.816, 'pos': 0.0, 'compound': -0.5574}"
8245,"I woke up to IOS 14.1 and there are so many changes, very confused","{'neg': 0.178, 'neu': 0.822, 'pos': 0.0, 'compound': -0.3804}"
8252,iOS 14 update shocking for your battery life,"{'neg': 0.278, 'neu': 0.722, 'pos': 0.0, 'compound': -0.4019}"
8268,My phone updated to iOS 14 on its own when I didn’t have automatic updates on cause I didn’t want it. Fuckin sad. It sucks ass,"{'neg': 0.299, 'neu': 0.658, 'pos': 0.043, 'compound': -0.8316}"
8273,How to manage alarms based on your sleep pattern in iOS 14,"{'neg': 0.16, 'neu': 0.84, 'pos': 0.0, 'compound': -0.2732}"
8278,Jiselle 1. nung birthday ni ewich 2.4months 3. Yes po 4. Yes po 5. Joyride po 6. 7. Black 8. 😾 9. Iloveyouusomuch…,"{'neg': 0.315, 'neu': 0.466, 'pos': 0.219, 'compound': -0.6486}"
8285,Do you think you leave when IOS 14.2 goes to everyone?,"{'neg': 0.107, 'neu': 0.893, 'pos': 0.0, 'compound': -0.0516}"
8315,"My cell phone UPDATED by itself, I did not give it any permission to do so I HATE ios 14 is the most faith update ...","{'neg': 0.184, 'neu': 0.715, 'pos': 0.101, 'compound': -0.5521}"
8327,I’ve tried at iOS 14.2 Stuck at booting iOS 14.1 if not clean restore the apps cannot open,"{'neg': 0.291, 'neu': 0.709, 'pos': 0.0, 'compound': -0.6305}"
8333,"I thought this was a weirdly timed April Fool when I read the headline, but there is (kind of) a secret button on your…","{'neg': 0.165, 'neu': 0.835, 'pos': 0.0, 'compound': -0.3716}"
8336,❌ GW update: 14:10 Newbury to eading due 14:40 will be cancelled. Download the Train Beacon iOS app today ❌,"{'neg': 0.105, 'neu': 0.895, 'pos': 0.0, 'compound': -0.25}"
8357,❌ Northern update: 14:32 Morecambe to Leeds due 16:38 will be cancelled. Download the Train Beacon iOS app today ❌,"{'neg': 0.105, 'neu': 0.895, 'pos': 0.0, 'compound': -0.25}"
8390,❌ Northern update: 12:17 Leeds to Wigan North Western due 14:30 has been cancelled. Download the Train Beacon iOS a…,"{'neg': 0.1, 'neu': 0.9, 'pos': 0.0, 'compound': -0.25}"
8393,my phone updated to ios 14 JUST now and i am big confuse,"{'neg': 0.147, 'neu': 0.853, 'pos': 0.0, 'compound': -0.2263}"
8397,"Bitches be like IOS 14 this IOS 14 that, BITCH SHUT UP NEW OGAN DOPPED","{'neg': 0.368, 'neu': 0.523, 'pos': 0.109, 'compound': -0.7865}"
8402,"My cell phone was updated with iOS 14 and I don't understand, it helps","{'neg': 0.154, 'neu': 0.846, 'pos': 0.0, 'compound': -0.2924}"
8405,my Barclaycard app stopped working with IOS 14.1 on my iPhone. Is there a recognised problem?,"{'neg': 0.261, 'neu': 0.739, 'pos': 0.0, 'compound': -0.5574}"
8418,"❝ streaming apps premium❞ 𑁍 new price list !! • netflix anti on hold • spotify [inplan, famplan, adm famplan] • vi…","{'neg': 0.153, 'neu': 0.847, 'pos': 0.0, 'compound': -0.4374}"
8432,"iOS devs: I've been quarantined, working from home, for months now, beyond stressed out. There is no way that I can have…","{'neg': 0.195, 'neu': 0.805, 'pos': 0.0, 'compound': -0.5574}"
8450,I'm already on Ios 14,"{'neg': 0.0, 'neu': 1.0, 'pos': 0.0, 'compound': 0.0}"
8454,My phone finally decided to update itself to iOS 14 idk how to feel about this,"{'neg': 0.085, 'neu': 0.915, 'pos': 0.0, 'compound': -0.1027}"
8455,"After almost 5 months using iOS 14, the only drawback I can get is that the widgets are not interactive. I use more than ...","{'neg': 0.0, 'neu': 1.0, 'pos': 0.0, 'compound': 0.0}"
8471,"After almost 5 months using iOS 14, the only drawback I can get is that the widgets are not interactive. Us ...","{'neg': 0.0, 'neu': 1.0, 'pos': 0.0, 'compound': 0.0}"
8480,Who the hell told my phone to finally update that iOS 14 shit,"{'neg': 0.427, 'neu': 0.573, 'pos': 0.0, 'compound': -0.8481}"
8509,#조이버블 #kpop nsfw au fanfic nudes leaked smut live sex porn boobs cock dick rate edit ios 14 iphone 12 gay lesbian +…,"{'neg': 0.265, 'neu': 0.735, 'pos': 0.0, 'compound': -0.7351}"
8524,❌ Northern update: 12:53 Skipton to Morecambe due 14:24 will be cancelled. Download the Train Beacon iOS app today ❌,"{'neg': 0.105, 'neu': 0.895, 'pos': 0.0, 'compound': -0.25}"
8525,Apple is already screwing up ios 14?,"{'neg': 0.241, 'neu': 0.759, 'pos': 0.0, 'compound': -0.2263}"
8530,"With Apple's iOS 14 looming over the horizon, we all have endless questions about what to do and what to expect. Here ar…","{'neg': 0.064, 'neu': 0.936, 'pos': 0.0, 'compound': -0.128}"
8532,"If you're getting this annoying popup everytime you unlock your phone because you installed the iOS 14 beta, try removing th…","{'neg': 0.135, 'neu': 0.865, 'pos': 0.0, 'compound': -0.481}"
8535,did you realise ‘Capture outside the frame’ is no longer a thing in iOS 14? I was trying to do it at the w…,"{'neg': 0.095, 'neu': 0.905, 'pos': 0.0, 'compound': -0.296}"
8545,❌ Avanti West Coast update: 15:50 Birmingham New Street to London Euston due 17:14 will be cancelled. Download the…,"{'neg': 0.105, 'neu': 0.895, 'pos': 0.0, 'compound': -0.25}"
8550,"I turned off auto-update on my phone as soon as I bought it. Still on iOS 11, which means I’m missing so…","{'neg': 0.104, 'neu': 0.896, 'pos': 0.0, 'compound': -0.296}"
8555,❌ Avanti West Coast update: 14:03 London Euston to Birmingham New Street due 15:24 will be cancelled. Download the…,"{'neg': 0.105, 'neu': 0.895, 'pos': 0.0, 'compound': -0.25}"
8558,11. #SwiftUI When to use it? If you're going to build a new app which is #iOS 14+ (not 13 no even col…,"{'neg': 0.095, 'neu': 0.905, 'pos': 0.0, 'compound': -0.296}"
8569,#kpop wap nsfw gay lesbian chaennie lisoo satzu saida boobs leaked nudes looking for moots live #followtrick questi…,"{'neg': 0.119, 'neu': 0.881, 'pos': 0.0, 'compound': -0.3182}"
8571,#kpop wap nsfw gay lesbian chaennie lisoo satzu saida boobs leaked nudes looking for moots live #followtrick quest…,"{'neg': 0.119, 'neu': 0.881, 'pos': 0.0, 'compound': -0.3182}"
8573,#kpop au fanfiction smut gay 2yeon michaeng jenlisa boobs leaked nudes sex pussy cock dick live #AppleEvent follow…,"{'neg': 0.324, 'neu': 0.676, 'pos': 0.0, 'compound': -0.7351}"
8574,#kpop wap nsfw gay lesbian chaennie lisoo satzu saida boobs leaked nudes looking for moots live #followtrick questi…,"{'neg': 0.119, 'neu': 0.881, 'pos': 0.0, 'compound': -0.3182}"
8575,#조이버블 #kpop nsfw au fanfic nudes leaked smut live sex porn boobs cock dick rate edit ios 14 iphone 12 gay lesbian +…,"{'neg': 0.265, 'neu': 0.735, 'pos': 0.0, 'compound': -0.7351}"
8576,#kpop au fanfiction smut gay 2yeon michaeng jenlisa boobs leaked nudes sex pussy cock dick live #AppleEvent follow…,"{'neg': 0.324, 'neu': 0.676, 'pos': 0.0, 'compound': -0.7351}"
8577,#kpop wap nsfw gay lesbian chaennie lisoo satzu saida boobs leaked nudes looking for moots live #followtrick questi…,"{'neg': 0.119, 'neu': 0.881, 'pos': 0.0, 'compound': -0.3182}"
8578,#조이버블 #kpop nsfw au fanfic nudes leaked smut live sex porn boobs cock dick rate edit ios 14 iphone 12 gay lesbian +…,"{'neg': 0.265, 'neu': 0.735, 'pos': 0.0, 'compound': -0.7351}"
8581,#조이버블 #kpop nsfw au fanfic nudes leaked smut live sex porn boobs cock dick rate edit ios 14 iphone 12 gay lesbian +…,"{'neg': 0.265, 'neu': 0.735, 'pos': 0.0, 'compound': -0.7351}"
8583,The change was in iOS 14 but you should still be able to access it from the Clock app &gt; Alarms if you al…,"{'neg': 0.103, 'neu': 0.897, 'pos': 0.0, 'compound': -0.3919}"
8606,"Also on iOS 14.1, just checked, no new update","{'neg': 0.216, 'neu': 0.784, 'pos': 0.0, 'compound': -0.296}"
8627,"Eventually, in 2027, Australia receives ECG; confirms it is no longer “The Outback.” &gt; Apple Wat…","{'neg': 0.128, 'neu': 0.872, 'pos': 0.0, 'compound': -0.296}"
8634,apple is auto installing ios 14 so i might cry later today,"{'neg': 0.253, 'neu': 0.747, 'pos': 0.0, 'compound': -0.5233}"
8637,"[MacWorld] iOS 14 latest version, problems &amp; new features coming to iPhone","{'neg': 0.197, 'neu': 0.803, 'pos': 0.0, 'compound': -0.4019}"
8640,"Amber “TUD”, KAMA IS A BITCH. Johnny Depp LOSES 'libel trial of the century': High Court rules Hollywood star IS…","{'neg': 0.308, 'neu': 0.692, 'pos': 0.0, 'compound': -0.8208}"
8642,(J’espère que tu es sous iOS 14 sinon ce que j’ai expliqué ne veut plus rien dire ^^),"{'neg': 0.15, 'neu': 0.85, 'pos': 0.0, 'compound': -0.4588}"
8655,"I thought iOS 14 was bad, but iOS 14.1 rendered my phone absolutely useless. I tried to restore it and now it can't…","{'neg': 0.235, 'neu': 0.662, 'pos': 0.103, 'compound': -0.5558}"
8660,Johnny Depp LOSES 'libel trial of the century': High Court rules Hollywood star IS a wife-beater - as he faces ruin…,"{'neg': 0.144, 'neu': 0.856, 'pos': 0.0, 'compound': -0.4648}"
8663,since update ios 14.1 battery cepat betul turun. aku stress,"{'neg': 0.237, 'neu': 0.763, 'pos': 0.0, 'compound': -0.4215}"
8664,FYI: NHS Login fails on iOS 14.2elease Candidate (18B91),"{'neg': 0.227, 'neu': 0.568, 'pos': 0.205, 'compound': -0.0688}"
8676,Speaking of worst screens... have you tried to setup an alarm on iOS 14 recently?,"{'neg': 0.333, 'neu': 0.667, 'pos': 0.0, 'compound': -0.7579}"
8690,"@AppleSupport Hello, I created two shortcuts to change the dials of my watch 6. Unfortunately they works one day an…","{'neg': 0.112, 'neu': 0.794, 'pos': 0.093, 'compound': -0.1027}"
8692,"oomfies pls drop your ios 14 wallpapers, i need inspiration✨","{'neg': 0.202, 'neu': 0.673, 'pos': 0.125, 'compound': -0.2023}"
8701,Thats tough my man it happens when you dont have storage try to delete some apps or…,"{'neg': 0.086, 'neu': 0.914, 'pos': 0.0, 'compound': -0.128}"
8713,people who updated to ios 14 did your snapchat notifs stop working? i finally updated on the weekend and now i don'…,"{'neg': 0.104, 'neu': 0.896, 'pos': 0.0, 'compound': -0.296}"
8731,Xs for me had a shit battery and got even worse the last month of having the ios 14 beta. Made my phone soo…,"{'neg': 0.242, 'neu': 0.758, 'pos': 0.0, 'compound': -0.7717}"
8757,Johnny Depp LOSES 'libel trial of the century': High Court rules Hollywood star IS a wife-beater - as he faces ruin…,"{'neg': 0.144, 'neu': 0.856, 'pos': 0.0, 'compound': -0.4648}"
8759,"i just did with iphone 7plus ios 14.1 GSM hello bypass, but failed, it returned to the activation screen. V2.6","{'neg': 0.198, 'neu': 0.802, 'pos': 0.0, 'compound': -0.6652}"
8782,I wonder if Megs will think again 🤔Johnny Depp LOSES 'libel trial of the century': High Court rules Hollywood star…,"{'neg': 0.144, 'neu': 0.856, 'pos': 0.0, 'compound': -0.4648}"
8785,Johnny Depp LOSES 'libel trial of the century': High Court rules Hollywood star is a WIFE-BEATE - as he faces ruin ov…,"{'neg': 0.275, 'neu': 0.725, 'pos': 0.0, 'compound': -0.7804}"
8789,Johnny Depp LOSES 'libel trial of the century': High Court rules Hollywood star is a WIFE-BEATE - as he faces ruin…,"{'neg': 0.144, 'neu': 0.856, 'pos': 0.0, 'compound': -0.4648}"
8798,ai ODIEEEEEEI UPDATE IOS 14 BUT WHAT BAG WILL TAKE IN THE CU APPLE DUA FUCKED FUCKED,"{'neg': 0.49, 'neu': 0.51, 'pos': 0.0, 'compound': -0.9545}"
8813,"Network problem with iOS 14.01, Damned it!! Very slow. So today update to 14.1, hope it’s not an illusion fast network. Damned!","{'neg': 0.296, 'neu': 0.607, 'pos': 0.098, 'compound': -0.7074}"
8830,"Bro, why apple no add widget contact on ios 14. Ver 14.2 , no have.","{'neg': 0.268, 'neu': 0.732, 'pos': 0.0, 'compound': -0.5267}"
8860,❌ Transport for Wales update: 03/11/20 13:14 Llandudno to Blaenau Ffestiniog due 14:35 will be cancelled. Download…,"{'neg': 0.118, 'neu': 0.882, 'pos': 0.0, 'compound': -0.25}"
8862,What are you planning to do with the IOS 14 problem? Its been a while that the game is unplayable o…,"{'neg': 0.124, 'neu': 0.876, 'pos': 0.0, 'compound': -0.4019}"
8890,"I'm currently having ""your company will not allow you to access your emails until you update to iOS…","{'neg': 0.089, 'neu': 0.911, 'pos': 0.0, 'compound': -0.1695}"
8945,"The bad news: - this is an iOS 14 only version. If you need iOS 13, you’ll have to keep the previous version. - If…","{'neg': 0.137, 'neu': 0.863, 'pos': 0.0, 'compound': -0.5423}"
8950,My Authenticator app won’t open this morning after updating to iOS 14.2 it’s going to be a long day :( @googledevs,"{'neg': 0.132, 'neu': 0.868, 'pos': 0.0, 'compound': -0.4404}"
8965,"Geri Horner cuts a casual figure in a cream jacket and white jeans as she goes for a family stroll with daughter Bluebell, 1…","{'neg': 0.096, 'neu': 0.826, 'pos': 0.078, 'compound': -0.1027}"
8985,Hengpong to automatic upgrade ios 14 even though it doesn't want to. Dropped my hengpong fast.,"{'neg': 0.075, 'neu': 0.925, 'pos': 0.0, 'compound': -0.0572}"
8995,pakyu ka ios 14.1 ang ayos nang storage ka tas bigla kang magpakita? please don't show your potangina again,"{'neg': 0.0, 'neu': 0.887, 'pos': 0.113, 'compound': 0.3182}"
9006,I think you can do it the same way;) thanks for the great idea 👍,"{'neg': 0.0, 'neu': 0.611, 'pos': 0.389, 'compound': 0.7906}"
9007,IOS 14.2 week right? @_fraanb_,"{'neg': 0.0, 'neu': 1.0, 'pos': 0.0, 'compound': 0.0}"
9011,If I missed your call more time I’ve swiped up. iOS 14 🤝,"{'neg': 0.18, 'neu': 0.82, 'pos': 0.0, 'compound': -0.296}"
9049,take my patience seriously ios 14 arrived already want to stick the 14.1 in my ass speak seriously,"{'neg': 0.311, 'neu': 0.631, 'pos': 0.059, 'compound': -0.6808}"
9087,"Hi Vheek Tor, sorry that iOS 14 is currently not available to unlock the lock. But we w…","{'neg': 0.071, 'neu': 0.929, 'pos': 0.0, 'compound': -0.0772}"
9090,"If you're getting this annoying popup everytime you unlock your phone because you installed the iOS 14 beta, try re…","{'neg': 0.141, 'neu': 0.859, 'pos': 0.0, 'compound': -0.481}"
9092,No ios 14,"{'neg': 0.524, 'neu': 0.476, 'pos': 0.0, 'compound': -0.296}"
9098,iOS 14 ain’t that bad not gonna lie :/,"{'neg': 0.279, 'neu': 0.558, 'pos': 0.162, 'compound': -0.3536}"
9112,"“new iOS update is now available, please update from iOS 14 beta.” keeps coming every 5 seconds. really annoying @Apple","{'neg': 0.134, 'neu': 0.763, 'pos': 0.103, 'compound': -0.1761}"
9121,Facebook CEO worries iOS 14 anti-tracking feature could hurt small businesses | Cult of Mac,"{'neg': 0.341, 'neu': 0.659, 'pos': 0.0, 'compound': -0.7351}"
9126,I’m doing the iOS 14 update on my phone and I’m kinda scared that it’s gonna fuck up my phone and I barely got this…,"{'neg': 0.217, 'neu': 0.783, 'pos': 0.0, 'compound': -0.7275}"
9130,"Tohle je další věc, do který jsem se ještě neponořil. Po upgrade na iOS 14 jsou moje budík…","{'neg': 0.175, 'neu': 0.825, 'pos': 0.0, 'compound': -0.5574}"
9149,I’ve neglected to mention that this “new” customization that comes with iOS 14 I been doing 10 years ago on my jailbroken device..,"{'neg': 0.139, 'neu': 0.861, 'pos': 0.0, 'compound': -0.5267}"
9152,Neuer iPhone-Button in iOS 14 - dieückseite (Back Tap) | geekyorganizer,"{'neg': 0.0, 'neu': 1.0, 'pos': 0.0, 'compound': 0.0}"
9189,no jailbreak on iOS 14? Would you tell me how to do this? This is kickass!,"{'neg': 0.16, 'neu': 0.84, 'pos': 0.0, 'compound': -0.4314}"
9192,Am I going to make my iOS 14 Home Screen Christmas.....you can bet your ass I am:),"{'neg': 0.2, 'neu': 0.8, 'pos': 0.0, 'compound': -0.5423}"
9196,FUCK nevermind if you never bought them you can’t play download them but if you did they run on iOS 14,"{'neg': 0.112, 'neu': 0.815, 'pos': 0.073, 'compound': -0.2303}"
9199,i didnt want to download ios 14,"{'neg': 0.196, 'neu': 0.804, 'pos': 0.0, 'compound': -0.0572}"
9202,Damn you iOS 14.1... 😖,"{'neg': 0.474, 'neu': 0.526, 'pos': 0.0, 'compound': -0.4019}"
9204,"for real, though, I just noticed that I can no longer swipe left and see when my next alarm is set. C…","{'neg': 0.204, 'neu': 0.796, 'pos': 0.0, 'compound': -0.5574}"
9236,"""IOS 14 will be installed automatically tonight"" - What about no?","{'neg': 0.196, 'neu': 0.804, 'pos': 0.0, 'compound': -0.296}"
9267,euphoria ariana grande chris evans animal crossing leak leaked thread bts harry styles charli damelio noah beck tik…,"{'neg': 0.196, 'neu': 0.625, 'pos': 0.179, 'compound': 0.1531}"
9276,Drop your iOS 14 Aesthetic I’m trying to see something.... Now that I know how to do this I’ll probably switch it…,"{'neg': 0.095, 'neu': 0.905, 'pos': 0.0, 'compound': -0.2732}"
